{
  "schema_version":1,"updated":"2026-08-01","tradition_id":"mesopotamian_babylonian","source_edition_id":"babylonian_rochberg_horoscopes_1998_awdl","source_file_sha256":"dd233eb1593135dacf280224288fb16cf3697df48fc9ec0347cc522959dff285","status":"edition_pages_inspected_published_longitude_tables_through_text27_independently_recomputed_eclipse_visibility_calendar_and_object_concordance_pending","tablet_count":8,"record_count":9,
  "records":[
    {
      "record_id":"rochberg1998.text21","rochberg_text_number":21,"artifact_ids":["BM 33018","78-7-30,12","L* 1468"],"cdli_id":null,"edition_pages":{"book":"116-120","pdf":"132-136"},
      "date":{"babylonian":"Seleucid Era 187, Ululu 22","editor_proposed_julian":"-124-10-01","confidence":"preserved"},"record_profile":["birth_notice","seasonal_hour","computed_birth_moon","planetary_signs","equinox","eclipses"],"preservation":"good","birth_time_status":"The 11th seasonal hour toward morning is preserved; the source interpolates the Moon from observations before sunrise on consecutive dates.",
      "recorded_data":[{"kind":"observed_moon_longitude","value":"Ululu 22 before sunrise, Cancer 24","textual_status":"preserved"},{"kind":"birth_hour_moon","value":"beginning of Leo, obtained by source interpolation for the 11th hour","textual_status":"editorial_inference"},{"kind":"sun_sign","value":"Libra","textual_status":"preserved"},{"kind":"jupiter_sign","value":"Aries","textual_status":"preserved"},{"kind":"venus_sign","value":"Leo","textual_status":"preserved"},{"kind":"saturn_sign","value":"Pisces","textual_status":"preserved"},{"kind":"mars_sign","value":"Gemini","textual_status":"preserved"},{"kind":"mercury_visibility","value":"set and not visible","textual_status":"preserved"},{"kind":"lunar_eclipse","value":"Abu 14, Pisces, date restored from computation","textual_status":"restored_by_editor"},{"kind":"solar_eclipse","value":"Virgo, watched for but not observed because it occurred after sunset","textual_status":"preserved"}],
      "explicit_judgments":[],"editorial_computation_status":"Published birth and observation tables inspected; independent reproduction pending.","engine_limits":["Keep the observed Moon and interpolated birth-hour Moon as distinct evidence.","The restored eclipse date must disappear in restoration-sensitive mode.","The opening blessing is not a natal prediction."],"pilot_eligibility":"include"
    },
    {
      "record_id":"rochberg1998.text22a","rochberg_text_number":22,"artifact_ids":["BM 41301","81-4-28,849"],"cdli_id":null,"edition_pages":{"book":"121-124","pdf":"137-140"},
      "date":{"babylonian":"Seleucid Era 195, Du'uzu 2 with day restored","editor_proposed_julian":"-116-07-15","confidence":"editorially_reconstructed"},"record_profile":["first_horoscope_on_collection_tablet","seasonal_hour","planetary_signs","solstice","eclipses"],"preservation":"mixed","birth_time_status":"Seventh seasonal hour is preserved; the day number is restored from astronomical fit.",
      "recorded_data":[{"kind":"moon_sign","value":"Virgo","textual_status":"preserved"},{"kind":"sun_sign","value":"Cancer","textual_status":"preserved"},{"kind":"jupiter_sign","value":"Scorpius","textual_status":"preserved"},{"kind":"venus_sign","value":"Cancer","textual_status":"preserved"},{"kind":"saturn_sign","value":"Cancer","textual_status":"preserved"},{"kind":"mars_sign","value":"Cancer","textual_status":"restored_by_editor"},{"kind":"mercury_visibility","value":"set and not visible","textual_status":"preserved"},{"kind":"solar_eclipse","value":"Virgo, not visible in Babylon","textual_status":"preserved"},{"kind":"lunar_eclipse","value":"Aries; day number broken","textual_status":"partly_preserved"}],
      "explicit_judgments":[],"editorial_computation_status":"Published table and eclipse identifications inspected; independent reproduction pending.","engine_limits":["The restored birth day and Mars sign require mutation tests.","Eclipse visibility is event-specific, not a personal omen."],"pilot_eligibility":"include_with_restoration_tests"
    },
    {
      "record_id":"rochberg1998.text22b","rochberg_text_number":22,"artifact_ids":["BM 41301","81-4-28,849"],"cdli_id":null,"edition_pages":{"book":"121-125","pdf":"137-141"},
      "date":{"babylonian":"Seleucid Era 197, Du'uzu 7","editor_proposed_julian":"-114-06-30","confidence":"preserved"},"record_profile":["second_horoscope_on_collection_tablet","seasonal_hour","planetary_signs","solstice","eclipse_conflicts"],"preservation":"mixed","birth_time_status":"Sixth seasonal hour is preserved.",
      "recorded_data":[{"kind":"moon_sign","value":"Cancer in text; published computation Scorpius 6","textual_status":"preserved"},{"kind":"sun_position","value":"end of Cancer","textual_status":"preserved"},{"kind":"jupiter_sign","value":"Aquarius","textual_status":"preserved"},{"kind":"venus_sign","value":"Gemini, restored or uncertain","textual_status":"restored_by_editor"},{"kind":"mercury_sign","value":"Cancer(?) in text; published computation Leo 1","textual_status":"partly_preserved"},{"kind":"saturn_and_mars_visibility","value":"set and not visible","textual_status":"preserved"},{"kind":"solar_eclipse","value":"text says Leo; computed eclipse was invisible in Babylon and in Aquarius, the diametrically opposite sign","textual_status":"preserved"}],
      "explicit_judgments":[],"editorial_computation_status":"Published table contains material Moon, Mercury, and eclipse-sign conflicts; independent reproduction pending.","engine_limits":["Do not silently reconcile the Moon or Mercury discrepancies.","Do not correct the solar-eclipse sign; preserve the source/editorial conflict.","Venus requires restoration-sensitive handling."],"pilot_eligibility":"include_with_restoration_tests"
    },
    {
      "record_id":"rochberg1998.text23","rochberg_text_number":23,"artifact_ids":["BM 34003","LBAT 1470"],"cdli_id":null,"edition_pages":{"book":"126-128","pdf":"142-144"},
      "date":{"babylonian":"Seleucid Era 223, Tebetu 9","editor_proposed_julian":"-087-01-05","confidence":"preserved"},"record_profile":["birth_notice","middle_of_night","degree_positions","eclipse_uncertainty","damaged_reverse"],"preservation":"mixed","birth_time_status":"Middle of night is preserved; source computes around Babylonian midnight.",
      "recorded_data":[{"kind":"moon_longitude","value":"Taurus 5","textual_status":"preserved"},{"kind":"sun_longitude","value":"Capricorn 20","textual_status":"preserved"},{"kind":"jupiter_longitude","value":"Aries 27","textual_status":"preserved"},{"kind":"venus_longitude","value":"Pisces 1","textual_status":"preserved"},{"kind":"mercury_longitude","value":"Sagittarius 26","textual_status":"preserved"},{"kind":"saturn_longitude","value":"Gemini 20(?), restored from modern computation","textual_status":"restored_by_editor"},{"kind":"mars_longitude","value":"Leo 20","textual_status":"preserved"},{"kind":"solar_eclipse_reference","value":"date unclear and no solar eclipse occurred on the apparent date","textual_status":"damaged"},{"kind":"lunar_eclipse","value":"Addaru 13 and Virgo 22 restored from computation","textual_status":"restored_by_editor"}],
      "explicit_judgments":[],"editorial_computation_status":"Published table inspected; eclipse chronology and restored Saturn remain uncertain; independent reproduction pending.","engine_limits":["The very damaged reverse may contain a personal name, not an executable judgment.","Restored Saturn and eclipse details must be removable.","Preserve alternative eclipse-date possibilities."],"pilot_eligibility":"include_with_restoration_tests"
    },
    {
      "record_id":"rochberg1998.text24","rochberg_text_number":24,"artifact_ids":["BM 77265","SH 83-9-28,16","L* 1471"],"cdli_id":null,"edition_pages":{"book":"129-131","pdf":"145-147"},
      "date":{"babylonian":"Seleucid Era 229, Kislimu 27(?)","editor_proposed_julian":"-082-12-19/21","confidence":"partly_preserved"},"record_profile":["birth_notice","middle_of_night","planetary_signs","mercury_first_visibility","eclipse_uncertainty"],"preservation":"mixed","birth_time_status":"Middle of night is preserved; broken day permits a three-day Julian span.",
      "recorded_data":[{"kind":"moon_sign","value":"Sagittarius","textual_status":"preserved"},{"kind":"sun_sign","value":"Sagittarius in text; table computation Capricorn 1 on central date","textual_status":"preserved"},{"kind":"jupiter_sign","value":"Scorpius","textual_status":"preserved"},{"kind":"mercury_first_visibility","value":"19th, east, Sagittarius","textual_status":"preserved"},{"kind":"saturn_sign","value":"Virgo","textual_status":"restored_by_editor"},{"kind":"mars_sign","value":"Libra","textual_status":"preserved"},{"kind":"venus_visibility","value":"set and not visible / with the Sun","textual_status":"partly_preserved"},{"kind":"eclipse_references","value":"lunar and solar identifications present problems","textual_status":"damaged"}],
      "explicit_judgments":[],"editorial_computation_status":"Three-day dating window and published central-date table inspected; independent reproduction pending.","engine_limits":["Use an interval, not a false exact date.","Preserve the Sun text/table boundary discrepancy.","Do not generate eclipse interpretations from unidentified events."],"pilot_eligibility":"include_with_restoration_tests"
    },
    {
      "record_id":"rochberg1998.text25","rochberg_text_number":25,"artifact_ids":["BM 42025","BM 42164","L* 1472"],"cdli_id":null,"edition_pages":{"book":"132-133","pdf":"148-149"},
      "date":{"babylonian":"Seleucid Era 231, Nisannu 14/15(?)","editor_proposed_julian":"-080-04-22/23","confidence":"editorially_reconstructed"},"record_profile":["birth_notice","planetary_signs","lunar_eclipse","solstice","restored_date"],"preservation":"mixed","birth_time_status":"Night of the 15th/16th(?) is uncertain; source selects 16 UT for comparison.",